{
  "name": "Eldridian Sceptre",
  "type": "gear",
  "system": {
    "contractVersion": 1,
    "description": "<h3>Effects</h3>\nEchoing Barrier (passive, support): As the wielder activates this ability, a shimmering barrier of soft blue and white light erupts around them, filling the air with the sweet scent of blooming wildflowers. The sound of gentle chimes echoes through the area, creating a sense of calm focus. The barrier seems to absorb and deflect incoming attacks, protecting not just the wielder but also their allies within its radius.\n<h3>History</h3>\n<h5>Introduction to the Eldridian Sceptre</h5>\n<p>In the realm of Elyriaea, where ancient magic and mystery entwine with the whispers of forgotten civilizations, the Eldridian Sceptre stands as a beacon of power and intrigue. Forged in the heart of Eldrida's Peak by a secretive group of mages, this legendary item is imbued with the essence of celestial bodies, holding the key to unlock the hidden patterns of the universe. Its history is a tapestry woven from threads of discovery, loss, and rebirth, reflecting the very essence of Elyriaea itself.</p>\n<h5>The Era of Creation</h5>\n<p>The story of the Eldridian Sceptre begins in an era long past, when the ancient civilization that once thrived on Eldrida's Peak was at its zenith. This enigmatic culture, known for their profound understanding of celestial mechanics and arcane arts, sought to create an artifact that would bridge the gap between the mortal realm and the cosmos. Through decades of dedicated research and experimentation, a secretive group of mages succeeded in forging the Eldridian Sceptre. The sceptre was said to contain not only the power of the elements but also the essence of stars and planets, making it an unparalleled tool for those who sought to understand and manipulate the universe's hidden patterns.</p>\n<h5>The Age of Lost Knowledge</h5>\n<p>Following its creation, the Eldridian Sceptre was used by its creators to achieve great feats, advancing their civilization to unprecedented heights. However, as with all things, time brought about decline and eventual downfall. The civilization vanished, leaving behind only remnants of their knowledge and achievements. The Eldridian Sceptre, once a symbol of their power and wisdom, was lost to the sands of time, hidden away in the depths of Eldrida's Peak. For centuries, its existence became a myth, a legend whispered among scholars and treasure hunters who dared to dream of uncovering its secrets.</p>\n<h5>The Age of Rediscovery</h5>\n<p>The dawn of the Age of Rebirth marked a significant turning point in the history of Elyriaea. As the world began to heal from the wounds of past conflicts and magical cataclysms, interest in ancient artifacts and forgotten knowledge saw a resurgence. It was during this era that the Eldridian Sceptre resurfaced, found by a powerful collector who recognized its potential to further their ambitions. News of its rediscovery sent ripples throughout Elyriaea, drawing mages, adventurers, and scholars to Eldrida's Peak in pursuit of the sceptre and the secrets it holds.</p>\n<h5>The Contemporary Era</h5>\n<p>Today, the Eldridian Sceptre remains intact, radiating a faint aura of mystical energy. Its current status as a focal point for those seeking power, knowledge, or redemption has made it a central figure in the geopolitics of Elyriaea. Alliances are formed and rivalries are sparked over the mere possibility of gaining control over the sceptre. The journey to claim it is perilous, fraught with ancient traps, mysterious creatures, and competing treasure hunters. Yet, for many, the potential reward is worth the risk. The sceptre's power to unlock the universe's secrets promises not only personal gain but also a deeper understanding of Elyriaea itself, making its pursuit a noble endeavor for some and a dangerous obsession for others.</p>\n<h5>The Future of the Eldridian Sceptre</h5>\n<p>As the Age of Rebirth continues to unfold, the fate of the Eldridian Sceptre remains uncertain. Will it fall into the hands of those who would use its power for the greater good, or will it become a tool for domination and chaos? The answer lies in the hearts of those who seek it and the paths they choose to tread. One thing is certain, however: the Eldridian Sceptre's journey is far from over. Its legend will continue to inspire quests, forge alliances, and spark conflicts, leaving an indelible mark on the history of Elyriaea. The sceptre stands as a testament to the ingenuity and ambition of those who came before, a beacon calling out to those brave enough to uncover its secrets and wield its power.</p>",
    "cost": 0,
    "weight": "0.8 kg",
    "rarity": "legendary",
    "item_type": "utility",
    "category": "item",
    "consumable": false,
    "duration": "Permanent, but its power can only be unlocked by one who has spent a decade studying the ancient lore of Elyriaea"
  },
  "img": "https://storyweald.com/image/6a4e525aa55db7a13c708bf9/orig"
}
